texto;links;code_area;area
HOW HARMFUL CAN CHINESE EXPORTS BE TO BRAZILIAN EXPORTS TO MERCOSUR?: A SIMILARITY AND QUALITY ANALYSIS REVISITED;https://www.anpec.org.br/encontro/2019/submissao/files_I/i7-7a9dadd59846204b79899e5900299996.pdf;i7;Área 7 - Economia Internacional
IMPORT PROTECTION THROUGH ANTIDUMPING FILINGS AND ECONOMIC ACTIVITY;https://www.anpec.org.br/encontro/2019/submissao/files_I/i7-5d9fc625a62e2ddd5d066f16cc7eada7.docx;i7;Área 7 - Economia Internacional
O AMBIENTE POLÍTICO E A ATRAÇÃO DE INVESTIMENTO EXTERNO DIRETO: UMA ABORDAGEM INSTITUCIONALISTA;https://www.anpec.org.br/encontro/2019/submissao/files_I/i7-6d90f78f3faca5e2eed738f88a93135e.docx;i7;Área 7 - Economia Internacional
O COMÉRCIO INTRAINDUSTRIAL E A COMPLEXIDADE ECONÔMICA;https://www.anpec.org.br/encontro/2019/submissao/files_I/i7-6e5d0e86c4108aad973422cbc6fccb7f.pdf;i7;Área 7 - Economia Internacional
PRODUTIVIDADE, HETEROGENEIDADE E MULTINACIONAIS BRASILEIRAS;https://www.anpec.org.br/encontro/2019/submissao/files_I/i7-04d80e97e036f00bf9eea263eca3f803.pdf;i7;Área 7 - Economia Internacional
QUALITY AND PENETRATION OF BRAZILIAN EXPORTS: WHAT IS THE EFFECT OF COMPARATIVE ADVANTAGE?;https://www.anpec.org.br/encontro/2019/submissao/files_I/i7-158f1347f540c345abbc35dcece579f3.pdf;i7;Área 7 - Economia Internacional
REGIONAL AND GLOBAL PATTERNS OF INSERTION IN VALUE CHAINS: EVIDENCE FOR BRAZIL;https://www.anpec.org.br/encontro/2019/submissao/files_I/i7-d9a0fa01ed67c5b62f9ff61ccd8de86e.pdf;i7;Área 7 - Economia Internacional
THE BRAZILIAN ECONOMIC CRISIS DURING THE PERIOD 2014-2016: IS THERE PRECEDENCE OF INTERNAL OR EXTERNAL FACTORS?;https://www.anpec.org.br/encontro/2019/submissao/files_I/i7-489788d347b4dcc432dfa84056ddb694.pdf;i7;Área 7 - Economia Internacional
THE ROLE OF INTERNATIONAL RESERVES ON REAL EXCHANGE RATE: A PANEL ARDL MODEL APPROACH;https://www.anpec.org.br/encontro/2019/submissao/files_I/i7-e663d175e7e89c0a1f449df31cf14d87.pdf;i7;Área 7 - Economia Internacional
VANTAGENS COMPARATIVAS AO NÍVEL DE FIRMAS: EVIDÊNCIAS INICIAIS PARA A INDÚSTRIA DE TRANSFORMAÇÃO BRASILEIRA;https://www.anpec.org.br/encontro/2019/submissao/files_I/i7-868d156b4ab0d52a645b37c10b45154f.pdf;i7;Área 7 - Economia Internacional
A BIVARIATE APPROACH TO THE MINCERIAN EARNINGS EQUATION;https://www.anpec.org.br/encontro/2019/submissao/files_I/i8-8cd88d32d7169458adf1684fbb3ef942.pdf;i8;Área 8 - Microeconomia, Métodos Quantitativos e Finanças
ARE CRYPTOCURRENCIES SUITABLE FOR PORTFOLIO DIVERSIFICATION? CROSS-COUNTRY EVIDENCE;https://www.anpec.org.br/encontro/2019/submissao/files_I/i8-a2719c2b29132625fa99c7f2b5ed47c3.pdf;i8;Área 8 - Microeconomia, Métodos Quantitativos e Finanças
BITCOIN IN BRAZIL: LAW OF ONE PRICE AND PRICE DISCOVERY IN AN EMERGING MARKET;https://www.anpec.org.br/encontro/2019/submissao/files_I/i8-181ac4d89a2205bca52b62911a16a823.pdf;i8;Área 8 - Microeconomia, Métodos Quantitativos e Finanças
BITCOIN'S RETURN VOLATILITY AND UNCERTAINTY SHOCKS;https://www.anpec.org.br/encontro/2019/submissao/files_I/i8-cb91e1b9f7956a1be8427189ec50faea.pdf;i8;Área 8 - Microeconomia, Métodos Quantitativos e Finanças
CARTEL SCREENING IN THE BRAZILIAN FUEL RETAIL MARKET;https://www.anpec.org.br/encontro/2019/submissao/files_I/i8-3c3393173e6fa08a096877362c5f6c57.pdf;i8;Área 8 - Microeconomia, Métodos Quantitativos e Finanças
EFEITOS DO BNDES NAS FIRMAS BRASILEIRAS: UM ESTUDO DE ANÁLISE DE SOBREVIVÊNCIA PARA OS ANOS DE 2002 A 2016.;https://www.anpec.org.br/encontro/2019/submissao/files_I/i8-fd6c24ba14230705cc9d1e81843d565b.pdf;i8;Área 8 - Microeconomia, Métodos Quantitativos e Finanças
GOVERNANÇA CORPORATIVA E EFICIÊNCIA DE MERCADO: ANÁLISE DE FLUTUAÇÕES DESTENDENCIADAS MULTIFRACTAIS;https://www.anpec.org.br/encontro/2019/submissao/files_I/i8-b03f2d17deeeeadbbb936bab68a839fc.pdf;i8;Área 8 - Microeconomia, Métodos Quantitativos e Finanças
LONG MEMORY AND TERM STRUCTURE OF INTEREST RATES;https://www.anpec.org.br/encontro/2019/submissao/files_I/i8-15b69b3b4f0a0ca3ae1555b9a763ee92.pdf;i8;Área 8 - Microeconomia, Métodos Quantitativos e Finanças
O EFEITO DA POLÍTICA DE DESONERAÇÃO DA FOLHA DE PAGAMENTOS SOBRE AS ESTRUTURAS DE MERCADO NO BRASIL;https://www.anpec.org.br/encontro/2019/submissao/files_I/i8-7d2f00cbbe94a55c0d9e1ced396c0547.pdf;i8;Área 8 - Microeconomia, Métodos Quantitativos e Finanças
POLITICAL POLARIZATION VS. FACT-CHECKING: EMERGENCE OF IMPUDENT LIES IN SOCIAL MEDIA;https://www.anpec.org.br/encontro/2019/submissao/files_I/i8-d898d7ab9705fc898b735bd547f3bc07.pdf;i8;Área 8 - Microeconomia, Métodos Quantitativos e Finanças
ROTATIVIDADE DE TREINADORES E O DESEMPENHO DAS EQUIPES DE FUTEBOL NO BRASIL;https://www.anpec.org.br/encontro/2019/submissao/files_I/i8-f3fd561df1cc7a9016f164201728a0e3.pdf;i8;Área 8 - Microeconomia, Métodos Quantitativos e Finanças
THE DARK SIDE OF PRUDENTIAL MEASURES;https://www.anpec.org.br/encontro/2019/submissao/files_I/i8-3fafe17800d86ff773801b29cdac3806.pdf;i8;Área 8 - Microeconomia, Métodos Quantitativos e Finanças
THIN SUBSIDIES EFFECTS ON FOOD CONSUMPTION PATTERN AND NUTRITIONAL STATUS OF BRAZILIAN POOR CHILDREN;https://www.anpec.org.br/encontro/2019/submissao/files_I/i8-4895e15efddc6a69ba0fecb9d35f9002.pdf;i8;Área 8 - Microeconomia, Métodos Quantitativos e Finanças
UMA ANÁLISE SOBRE A DEMANDA DOMICILIAR POR ALIMENTOS DE FAMÍLIAS BENEFICIÁRIAS E NÃO BENEFECIÁRIAS DO BOLSA FAMÍLIA POR MEIO DA POF 2008/2009;https://www.anpec.org.br/encontro/2019/submissao/files_I/i8-8e1fc5b64cfd45dbe2cc12e664adce84.docx;i8;Área 8 - Microeconomia, Métodos Quantitativos e Finanças
US RISK PREMIA UNDER EMERGING MARKETS CONSTRAINTS;https://www.anpec.org.br/encontro/2019/submissao/files_I/i8-cd23ae0311171513000899adb0775fac.pdf;i8;Área 8 - Microeconomia, Métodos Quantitativos e Finanças
USING THE MORAN’S I TO DETECT BID RIGGING IN BRAZILIAN PROCUREMENT AUCTIONS;https://www.anpec.org.br/encontro/2019/submissao/files_I/i8-65127d0233006f9d19b0a3f1b31d1395.pdf;i8;Área 8 - Microeconomia, Métodos Quantitativos e Finanças
WELFARE LOSS AND LERNER-DEMAND HYPOTHESIS: EVIDENCES FOR THE COMMERCIAL BANKS IN BRAZIL;https://www.anpec.org.br/encontro/2019/submissao/files_I/i8-6d82b19062043cd83d2349578b04143a.pdf;i8;Área 8 - Microeconomia, Métodos Quantitativos e Finanças
A PERVASIVIDADE INDUSTRIAL MULTIDIMENSIONAL DAS NOVAS TECNOLOGIAS HABILITADORAS;https://www.anpec.org.br/encontro/2019/submissao/files_I/i9-cb466b258ab31555861b107f19ba0d25.docx;i9;Área 9 - Economia Industrial e da Tecnologia
A SURVEY ON STYLIZED FACTS FOR BRAZILIAN MANUFACTURING: 1996-2013;https://www.anpec.org.br/encontro/2019/submissao/files_I/i9-618bc6d6845d5f2f348dfe2e819a858f.pdf;i9;Área 9 - Economia Industrial e da Tecnologia
AN EXPANDED KNOWLEDGE PRODUCTION FUNCTION: EVIDENCE FROM BRAZIL WITH A DYNAMIC SPATIAL PANEL APPROACH;https://www.anpec.org.br/encontro/2019/submissao/files_I/i9-a2ae7b89e873d6023ca298f745582101.pdf;i9;Área 9 - Economia Industrial e da Tecnologia
AN INVESTIGATION INTO SHAPES AND DETERMINANTS OF DEINDUSTRIALIZATION PROCESSES: THEORY AND EVIDENCE FOR DEVELOPED AND DEVELOPING COUNTRIES (1970-2017);https://www.anpec.org.br/encontro/2019/submissao/files_I/i9-4c06d516fee94627f7c83c14c15abb3a.pdf;i9;Área 9 - Economia Industrial e da Tecnologia
CONTEÚDO IMPORTADO NA DEMANDA FINAL DOMÉSTICA E EMPREGO ASSOCIADO ÀS EXPORTAÇÕES: UMA ANÁLISE INSUMO-PRODUTO PARA A ECONOMIA BRASILEIRA ENTRE 2000 E 2015;https://www.anpec.org.br/encontro/2019/submissao/files_I/i9-9564a8f2e57691e39ad8367682ceb395.pdf;i9;Área 9 - Economia Industrial e da Tecnologia
ECONOMIC CRISIS, INNOVATION AND ORGANIZATIONAL RESPONSES: EVIDENCE FROM BRAZIL;https://www.anpec.org.br/encontro/2019/submissao/files_I/i9-bdef69cf2d004c0873cfa82441072ad5.pdf;i9;Área 9 - Economia Industrial e da Tecnologia
IMPACTOS DOS INCENTIVOS FISCAIS NA INOVAÇÃO DE GRANDES EMPRESAS: UMA AVALIAÇÃO A PARTIR DA PESQUISA SONDAGEM DE INOVAÇÃO DA ABDI;https://www.anpec.org.br/encontro/2019/submissao/files_I/i9-679cb322aa36398a91c9bb07cb3f11ef.pdf;i9;Área 9 - Economia Industrial e da Tecnologia
ÍNDICE DE INOVAÇÃO GLOBAL - UMA ANÁLISE DA TRAJETÓRIA BRASILEIRA ENTRE OS ANOS DE 2007 A 2018;https://www.anpec.org.br/encontro/2019/submissao/files_I/i9-30bba0c8bcf2bb63bb77c7321c333b7f.pdf;i9;Área 9 - Economia Industrial e da Tecnologia
INNOVATION AND CAPABILITIES BUILDING IN BIOPHARMACEUTICALS IN BRAZIL: A KNOWLEDGE NETWORK ANALYSIS;https://www.anpec.org.br/encontro/2019/submissao/files_I/i9-66bd5df4f5cf287383c0a6e9c3d61d0e.pdf;i9;Área 9 - Economia Industrial e da Tecnologia
MEDIDAS DE GATEKEEPERS APLICADAS À REDE DE INVENÇÃO DO BRASIL;https://www.anpec.org.br/encontro/2019/submissao/files_I/i9-3ff1074a2597f54a8e7fb183b1ba15e3.pdf;i9;Área 9 - Economia Industrial e da Tecnologia
SINAIS VIRTUOSOS DO PROCESSO DE MUDANÇA ESTRUTURAL BRASILEIRO DURANTE OS GOVERNOS LULA E DILMA;https://www.anpec.org.br/encontro/2019/submissao/files_I/i9-7d2d181960b9b2cee44be81c2afbef15.docx;i9;Área 9 - Economia Industrial e da Tecnologia
TECHNICAL AND SKILL KNOWLEDGE INCORPORATED BY BIG-PHARMA IN ACQUISITIONS OF SMALL FIRMS;https://www.anpec.org.br/encontro/2019/submissao/files_I/i9-8063211204cc639044099a6ecccf36d1.docx;i9;Área 9 - Economia Industrial e da Tecnologia
TECHNOLOGICAL UNEMPLOYMENT IN BRAZIL: EFFECTS OF AUTOMATION ON JOB MARKET OCCUPATIONS;https://www.anpec.org.br/encontro/2019/submissao/files_I/i9-8d686480f6724a9101687d18564dcd76.pdf;i9;Área 9 - Economia Industrial e da Tecnologia
THE ECONOMIC EFFECTS OF FINANCING PRIVATE INVESTMENTS ON R&D IN BRAZIL;https://www.anpec.org.br/encontro/2019/submissao/files_I/i9-f055f0264a27b445dcb40c2f0c1dcd3f.pdf;i9;Área 9 - Economia Industrial e da Tecnologia
THE EFFECTS OF BNDES ON BRAZILIAN PHARMACEUTICAL FIRMS’ INNOVATION INVESTMENTS: A PANEL DATA APPROACH;https://www.anpec.org.br/encontro/2019/submissao/files_I/i9-7076f869aae3d8895dc2a09a28995462.pdf;i9;Área 9 - Economia Industrial e da Tecnologia
THE MOBILITY OF SKILLED WORKERS AND INNOVATION IN BRAZIL;https://www.anpec.org.br/encontro/2019/submissao/files_I/i9-30313dd1c562c6b427e4ccd8cae5f758.docx;i9;Área 9 - Economia Industrial e da Tecnologia
TRADE OPENNESS DEGREE AS TECHNOLOGY SPILLOVER CARRIER;https://www.anpec.org.br/encontro/2019/submissao/files_I/i9-6bbe30e967ae04fa17777ded63752442.pdf;i9;Área 9 - Economia Industrial e da Tecnologia
UMA ANÁLISE DOS FATORES DIRECIONADORES (DRIVERS) DA INTENSIDADE DAS INTERAÇÕES DE PEQUENAS E MÉDIAS EMPRESAS BRASILEIRAS COM UNIVERSIDADES E INSTITUTOS PÚBLICOS DE PESQUISA;https://www.anpec.org.br/encontro/2019/submissao/files_I/i9-15e9da4d4f09dba85ac868fbee2c0b8c.docx;i9;Área 9 - Economia Industrial e da Tecnologia
A VIOLÊNCIA URBANA E O PREÇO DOS IMÓVEIS: EVIDÊNCIAS DE COMO A CRIMINALIDADE AFETA O MERCADO IMOBILIÁRIO;https://www.anpec.org.br/encontro/2019/submissao/files_I/i10-29f600709d70e1b301d3c16c763085ba.docx;i10;Área 10 - Economia Regional e Urbana
AMBIENTE URBANO E CRIMINALIDADE: UMA ABORDAGEM DE MACHINE LEARNING PARA O CASO DA CIDADE DO RECIFE;https://www.anpec.org.br/encontro/2019/submissao/files_I/i10-939a661f9751491843de80d6bbf8c458.pdf;i10;Área 10 - Economia Regional e Urbana
AN INTER-REGIONAL NETWORK PERSPECTIVE TO EVALUATE THE BRAZILIAN ECONOMY;https://www.anpec.org.br/encontro/2019/submissao/files_I/i10-6e0deb272eefb74e54251a9838c400e9.docx;i10;Área 10 - Economia Regional e Urbana
ANÁLISE DOS DETERMINANTES DA EFICIÊNCA DA APLICAÇÃO DOS RECURSOS DO FNE PELOS MUNICÍPIOS BENEFICIADOS;https://www.anpec.org.br/encontro/2019/submissao/files_I/i10-8aad5dbd67f97c5deaf4239faf1983a5.docx;i10;Área 10 - Economia Regional e Urbana
DEMOGRAFIA E LOCALIZAÇÃO RESIDENCIAL: UMA ANÁLISE DA REGIÃO METROPOLITANA DO RECIFE;https://www.anpec.org.br/encontro/2019/submissao/files_I/i10-3905af66ff3b63d28efac795abdd6e38.docx;i10;Área 10 - Economia Regional e Urbana
DESASTRES TECNOLÓGICOS E IMPACTO ECONÔMICO PARA UMA ECONOMIA EM DESENVOLVIMENTO: EVIDÊNCIAS PARA O BRASIL;https://www.anpec.org.br/encontro/2019/submissao/files_I/i10-7548f714b60ff2dc99fcb1d6552b0651.pdf;i10;Área 10 - Economia Regional e Urbana
DEVAGAR E SEMPRE: OS EFEITOS DA REDUÇÃO NO LIMITE DE VELOCIDADE NOS ACIDENTES DE SÃO PAULO.;https://www.anpec.org.br/encontro/2019/submissao/files_I/i10-10bab52d8051b9193b1928099e8729ac.pdf;i10;Área 10 - Economia Regional e Urbana
DISTRIBUIÇÃO ESPACIAL DA ATIVIDADE ECONÔMICA E DESIGUALDADES REGIONAIS: EVIDÊNCIAS PARA OS MUNICÍPIOS DE MINAS GERAIS;https://www.anpec.org.br/encontro/2019/submissao/files_I/i10-480f0e9bb48d24a63662ad1c70c0119b.pdf;i10;Área 10 - Economia Regional e Urbana
ECONOMIAS DE AGLOMERAÇÃO E PROXIMIDADE GEOGRÁFICA: EVIDÊNCIAS PARA A INDÚSTRIA TÊXTIL E DE CONFECÇÃO DE PERNAMBUCO;https://www.anpec.org.br/encontro/2019/submissao/files_I/i10-9741a269565fd276e7c34ce1412af1dd.pdf;i10;Área 10 - Economia Regional e Urbana
IDENTIFICATION OF EMPLOYMENT SUBCENTERS IN BRAZILIAN METROPOLITAN REGIONS;https://www.anpec.org.br/encontro/2019/submissao/files_I/i10-5bbc4f56d19a715e4bcb780479f6a76a.pdf;i10;Área 10 - Economia Regional e Urbana
INDÚSTRIAS CRIATIVAS NO BRASIL: MAPEAMENTO DE AGLOMERAÇÕES PRODUTIVAS POTENCIAIS E SUA CONTRIBUIÇÃO PARA O DESENVOLVIMENTO LOCAL;https://www.anpec.org.br/encontro/2019/submissao/files_I/i10-88448c45aa17ae52ec469fa55e78248b.docx;i10;Área 10 - Economia Regional e Urbana
LOCALIZAÇÃO E SAÚDE NA CIDADE DE SALVADOR;https://www.anpec.org.br/encontro/2019/submissao/files_I/i10-08a8a87615fefb0f8e5d3b4ca4ff3070.docx;i10;Área 10 - Economia Regional e Urbana
LOCALIZATION PATTERNS OF SERVICE ACTIVITIES WITHIN METROPOLITAN AREAS: THE CASE OF SÃO PAULO;https://www.anpec.org.br/encontro/2019/submissao/files_I/i10-23a3a2ada5cb2c8ccb71e63a32d528de.pdf;i10;Área 10 - Economia Regional e Urbana
MORADIA, EMPREGABILIDADE E ACESSIBILIDADE AO MERCADO DE TRABALHO FORMAL: EVIDÊNCIAS DE SORTEIOS NO BRASIL;https://www.anpec.org.br/encontro/2019/submissao/files_I/i10-a8bce1188c00d6bc30c86e61a0eea2f9.pdf;i10;Área 10 - Economia Regional e Urbana
PLANEJAMENTO URBANO E ESTRUTURA DAS CIDADES: UMA AVALIAÇÃO DO PLANO DIRETOR USANDO UM DESENHO DE REGRESSÃO DESCONTINUA;https://www.anpec.org.br/encontro/2019/submissao/files_I/i10-5d7657d39136083e584ba533abaec8a2.docx;i10;Área 10 - Economia Regional e Urbana
REGIONAL INEQUALITY IN THE WAGE DISTRIBUTION ADJUSTED BY PURCHASING POWER: EVIDENCE FROM BRAZILIAN METROPOLITAN REGIONS;https://www.anpec.org.br/encontro/2019/submissao/files_I/i10-051a31805ac01504b0aab26ffb3718fd.docx;i10;Área 10 - Economia Regional e Urbana
THE GREAT PAULISTA CRIME DECLINE PUZZLE;https://www.anpec.org.br/encontro/2019/submissao/files_I/i10-deca550030a55a5e0b7f0bc8b591610d.pdf;i10;Área 10 - Economia Regional e Urbana
THE LONG-RUN ELASTICITY OF RESIDENTIAL ENERGY DEMAND: EVIDENCE FROM GEOGRAPHICAL REGIONS;https://www.anpec.org.br/encontro/2019/submissao/files_I/i10-50da0ef45a0de017726c152ed817ea14.pdf;i10;Área 10 - Economia Regional e Urbana
TRANSPORT AND POPULATION DENSITY IN THE URBAN AREA OF THE CITY OF SALVADOR;https://www.anpec.org.br/encontro/2019/submissao/files_I/i10-927504bd283e1612ca1a3d731444c23b.pdf;i10;Área 10 - Economia Regional e Urbana
TRANSPORTE RODOVIÁRIO DE PASSAGEIROS, FLUXO DE RENDA E CONSUMO: AVALIANDO OS EFEITOS ECONÔMICOS DE POLÍTICAS DA CIDE PARA A ECONOMIA BRASILEIRA;https://www.anpec.org.br/encontro/2019/submissao/files_I/i10-c72204553d06b52ad8e633f26091f9ff.pdf;i10;Área 10 - Economia Regional e Urbana
URBAN EMPLOYMENT SUBCENTERS: THE CASE OF CURITIBA, BRAZIL;https://www.anpec.org.br/encontro/2019/submissao/files_I/i10-1ef07e40df2f8bca3379063e1d77fa9d.pdf;i10;Área 10 - Economia Regional e Urbana
A ESTRUTURA DEMOGRÁFICA TEM EFEITOS NAS EMISSÕES DE POLUENTES? EVIDÊNCIAS A PARTIR DE DIFERENTES GRUPOS DE PAÍSES;https://www.anpec.org.br/encontro/2019/submissao/files_I/i11-225c9d6ed1da613bae613214c98c6721.pdf;i11;Área 11 - Economia Agrícola e do Meio Ambiente
A RELAÇÃO ENTRE SUBSÍDIOS À PESCA E AS EMISSÕES DE CO2 DO SETOR PESQUEIRO;https://www.anpec.org.br/encontro/2019/submissao/files_I/i11-2a01d91f644f2941e04a614d77bc00ff.pdf;i11;Área 11 - Economia Agrícola e do Meio Ambiente
AGRICULTURAL CREDIT, CROP INSURANCE AND THE RISK BALANCING HYPOTHESIS: EVIDENCE FROM BRAZIL;https://www.anpec.org.br/encontro/2019/submissao/files_I/i11-12dcf76367c2bbee59211945d6ebb92c.docx;i11;Área 11 - Economia Agrícola e do Meio Ambiente
BRAZILIAN FUTURE LAND-USE DYNAMICS IN DIVERSE BIOPHYSICAL AND SOCIOECONOMIC SCENARIOS;https://www.anpec.org.br/encontro/2019/submissao/files_I/i11-98e634f49f49106c77ff64065ab8ef79.docx;i11;Área 11 - Economia Agrícola e do Meio Ambiente
CRESCIMENTO ECONÔMICO E EMISSÕES DE GASES DE EFEITO ESTUFA: UMA ANÁLISE DA RELAÇÃO DE LONGO PRAZO PARA OS ESTADOS BRASILEIROS;https://www.anpec.org.br/encontro/2019/submissao/files_I/i11-1ba4e57590a9c9fa190af02d44b23cb5.pdf;i11;Área 11 - Economia Agrícola e do Meio Ambiente
DISSECTING BRAZILIAN BUSINESS AGRICULTURAL CYCLE IN HIGH-DIMENSIONAL AND MIXED-FREQUENCY CONTEXT;https://www.anpec.org.br/encontro/2019/submissao/files_I/i11-f2e280b000a4437ab3697d42d5a03376.pdf;i11;Área 11 - Economia Agrícola e do Meio Ambiente
ECONOMIC DEVELOPMENT AND DEFORESTATION IN THE BRAZILIAN AMAZON: A DYNAMIC SPATIAL PANEL APPROACH;https://www.anpec.org.br/encontro/2019/submissao/files_I/i11-6ae748d147bb6947c2202b83cfe60a63.pdf;i11;Área 11 - Economia Agrícola e do Meio Ambiente
INTEMPÉRIE CLIMÁTICA E POLÍTICA DE PROTEÇÃO SOCIAL: UMA AVALIAÇÃO DO PROGRAMA GARANTIA SAFRA NO COMBATE À INSEGURANÇA ALIMENTAR;https://www.anpec.org.br/encontro/2019/submissao/files_I/i11-b5bad54b452c0321b4678c7d8595eaa2.pdf;i11;Área 11 - Economia Agrícola e do Meio Ambiente
IRRIGATION, TECHNICAL EFFICIENCY AND FARM SIZE IN BRAZIL;https://www.anpec.org.br/encontro/2019/submissao/files_I/i11-e8a46ecc10b3bf315d2ac1f863fd5b28.pdf;i11;Área 11 - Economia Agrícola e do Meio Ambiente
MUDANÇAS NO MERCADO INTERNACIONAL DE ETANOL: CALIBRAÇÃO DE UM MODELO ESPACIAL USANDO PCM;https://www.anpec.org.br/encontro/2019/submissao/files_I/i11-033e7bc09499aad9d8d3bca3051c96d6.pdf;i11;Área 11 - Economia Agrícola e do Meio Ambiente
O ACORDO DE PARIS E AS EMISSÕES DE GASES: IMPACTOS SOBRE A PRODUÇÃO DE SUÍNOS NO BRASIL;https://www.anpec.org.br/encontro/2019/submissao/files_I/i11-e65600f219ff215a3fd3a06e23e596ae.pdf;i11;Área 11 - Economia Agrícola e do Meio Ambiente
THE ENVIRONMENTAL IMPACTS OF THE AGRICULTURAL FRONTIER EXPANSION IN THE CERRADO, BRAZIL;https://www.anpec.org.br/encontro/2019/submissao/files_I/i11-d519ad7dddeae7683c7e4a217ce10603.pdf;i11;Área 11 - Economia Agrícola e do Meio Ambiente
TRANSMISSÃO DE PREÇOS PAGOS AO PRODUTOR DE LEITE, ATACADO E VAREJO NOS ESTADOS BRASILEIROS: UMA ANÁLISE UTILIZANDO SPILLOVERS;https://www.anpec.org.br/encontro/2019/submissao/files_I/i11-1cd6818618d3aa57832b41db7bbc78a9.docx;i11;Área 11 - Economia Agrícola e do Meio Ambiente
USING COOPERATIVES TO REDUCE INCOME INEQUALITY IN THE BRAZILIAN RURAL SECTOR;https://www.anpec.org.br/encontro/2019/submissao/files_I/i11-fe69537cfbe1c20fc3db6d4a06e2eac4.pdf;i11;Área 11 - Economia Agrícola e do Meio Ambiente
USO DA ÁGUA NO BRASIL E SUA RELAÇÃO COM CONDICIONANTES ECONÔMICOS: ANÁLISE A PARTIR DE SIMULAÇÕES COM UM MODELO DE EQUILÍBRIO GERAL;https://www.anpec.org.br/encontro/2019/submissao/files_I/i11-be74db0fe3a4083ee282ae5c1a57bfd5.pdf;i11;Área 11 - Economia Agrícola e do Meio Ambiente
A BRIGHTER FUTURE: THE IMPACT OF RURAL SCHOOL ELECTRIFICATION PROGRAMS ON THE DROPOUT RATE IN PRIMARY EDUCATION IN BRAZIL;https://www.anpec.org.br/encontro/2019/submissao/files_I/i12-800a8ea4e12630dd1240585e1f45a959.pdf;i12;Área 12 - Economia Social e Demografia Econômica
A RELAÇÃO DE INCENTIVOS ENTRE O PROGRAMA BOLSA FAMÍLIA E O CASAMENTO INFANTIL FEMININO;https://www.anpec.org.br/encontro/2019/submissao/files_I/i12-8ac7cdb75261f0bc98ec7d6e8764451a.pdf;i12;Área 12 - Economia Social e Demografia Econômica
ANÁLISE DO DIFERENCIAL DE DESEMPENHO ENTRE ALUNOS DE ESCOLAS RURAIS E URBANAS;https://www.anpec.org.br/encontro/2019/submissao/files_I/i12-9b9bf33c33d9f188fbe0776d953ca388.pdf;i12;Área 12 - Economia Social e Demografia Econômica
AVALIAÇÃO DOS FUNDOS ESTADUAIS DE COMBATE À POBREZA NO NORDESTE A PARTIR DO MÉTODO DE CONTROLE SINTÉTICO GENERALIZADO;https://www.anpec.org.br/encontro/2019/submissao/files_I/i12-3d0901977975f5a966a8af1a5bd3ea4a.pdf;i12;Área 12 - Economia Social e Demografia Econômica
COFFEE PRICE SHOCK AND LOCAL ECONOMIC GROWTH: EVIDENCE FROM COLOMBIA;https://www.anpec.org.br/encontro/2019/submissao/files_I/i12-97a85d7dd374e12dcf8e07a8e2357a87.pdf;i12;Área 12 - Economia Social e Demografia Econômica
DETERMINANTES DA TRANSIÇÃO DESEMPREGO E EMPREGO DO JOVEM BRASILEIRO;https://www.anpec.org.br/encontro/2019/submissao/files_I/i12-e379ab087542567b094c578512ac231e.pdf;i12;Área 12 - Economia Social e Demografia Econômica
DISTÂNCIA À INSTITUIÇÃO DE ENSINO E DEMANDA POR EDUCAÇÃO SUPERIOR;https://www.anpec.org.br/encontro/2019/submissao/files_I/i12-ccc0216284d5dd12dce8134c3d65a264.pdf;i12;Área 12 - Economia Social e Demografia Econômica
DOES BULLYING AFFECT THE SCHOOL PERFORMANCE OF BRAZILIAN STUDENTS? AN ANALYSIS THROUGH OF PISA 2015;https://www.anpec.org.br/encontro/2019/submissao/files_I/i12-53cf46b1b2a41eca240d2bc1f6b12821.pdf;i12;Área 12 - Economia Social e Demografia Econômica
DOES LOCAL FISCAL POLICY AFFECT MIGRATION? EVIDENCE OF A FISCAL WINDFALL IN A DEVELOPING COUNTRY;https://www.anpec.org.br/encontro/2019/submissao/files_I/i12-c352774646be9eef49d2a1d4a639819a.pdf;i12;Área 12 - Economia Social e Demografia Econômica
DOMICÍLIOS CHEFIADOS POR MULHERES E CHOQUES DE RENDA: UMA ANÁLISE PARA AS REGIÕES METROPOLITANAS BRASILEIRAS NO PERÍODO DE 2011 A 2015;https://www.anpec.org.br/encontro/2019/submissao/files_I/i12-9dff3adaaf1149e0c3e78765dcd7b2ee.pdf;i12;Área 12 - Economia Social e Demografia Econômica
EFICIÊNCIA E SOLIDARISMO DOS EMPREENDIMENTOS DE ECONOMIA SOLIDÁRIA BRASILEIROS: UMA ANÁLISE EMPÍRICA COM O MÉTODO DE FRONTEIRA ESTOCÁSTICA;https://www.anpec.org.br/encontro/2019/submissao/files_I/i12-c1189d48d373f325f0609b09cf341d33.pdf;i12;Área 12 - Economia Social e Demografia Econômica
ENVIRONMENTAL DISASTERS AND BIRTH OUTCOMES: IMPACT OF A TAILINGS DAM BREAKAGE IN BRAZIL;https://www.anpec.org.br/encontro/2019/submissao/files_I/i12-6b62bc9c0b206ede926f3aa4192e13c1.pdf;i12;Área 12 - Economia Social e Demografia Econômica
ESGOTAMENTO SANITÁRIO E SAÚDE INFANTIL NOS MUNICÍPIOS BRASILEIROS: ANÁLISE A PARTIR DA EXPANSÃO NO ACESSO A FINANCIAMENTO DE LONGO PRAZO;https://www.anpec.org.br/encontro/2019/submissao/files_I/i12-04f3ff77b5269e14c1dfc9cd9c88f266.docx;i12;Área 12 - Economia Social e Demografia Econômica
EXPLICANDO AS DIFERENÇAS DE DESEMPENHO EDUCACIONAL NO BRASIL ENTRE ESTUDANTES DE ESCOLAS PRIVADAS E PÚBLICAS;https://www.anpec.org.br/encontro/2019/submissao/files_I/i12-dc8dc01ae75a6d479e7127769ccb2d48.pdf;i12;Área 12 - Economia Social e Demografia Econômica
FATORES ASSOCIADOS A INTENSIDADE DO CONSUMO DE ÁLCOOL POR ESCOLARES NO BRASIL;https://www.anpec.org.br/encontro/2019/submissao/files_I/i12-e8401a44788caff94484a7d328459940.pdf;i12;Área 12 - Economia Social e Demografia Econômica
FILHO DE PEIXE, PEIXINHO É? A TRANSMISSÃO INTERGERACIONAL DE ESCOLHA DE OCUPAÇÕES;https://www.anpec.org.br/encontro/2019/submissao/files_I/i12-ea33c2a7566bee81bec5abda1fc20075.pdf;i12;Área 12 - Economia Social e Demografia Econômica
HABITAÇÃO E DOENÇAS SANITÁRIAS: UMA ABORDAGEM UTILIZANDO UM DESENHO DE REGRESSÃO DESCONTINUA;https://www.anpec.org.br/encontro/2019/submissao/files_I/i12-d7cc81b0bd337fdbf22db142970f6c04.pdf;i12;Área 12 - Economia Social e Demografia Econômica
HEALTH AT BIRTH AND THE DYNAMICS OF RACIAL INEQUALITY IN HUMAN CAPITAL FORMATION IN BRAZIL;https://www.anpec.org.br/encontro/2019/submissao/files_I/i12-ce4a9f4bf7b5310ac423ff26b202ebe1.pdf;i12;Área 12 - Economia Social e Demografia Econômica
HEY, TEACHERS! DON'T LEAVE THEM KIDS ALONE: O EFEITO DAS EXPECTATIVAS DOS PROFESSORES SOBRE O MINDSET DOS ALUNOS;https://www.anpec.org.br/encontro/2019/submissao/files_I/i12-da007da9340b03597fe2ebec538ab6be.pdf;i12;Área 12 - Economia Social e Demografia Econômica
HOW DOES EARLY MARRIAGE AFFECT THE EDUCATION OF WOMEN IN BRAZIL?;https://www.anpec.org.br/encontro/2019/submissao/files_I/i12-96cb9122a2bf5b6276f26c9b16711f43.pdf;i12;Área 12 - Economia Social e Demografia Econômica
IMPACT OF THE BRAZILIAN FAMILY HEALTH STRATEGY ON SEXUAL AND REPRODUCTIVE HEALTH OUTCOMES: AN ANALYSIS AT INDIVIDUAL AND POPULATION LEVELS;https://www.anpec.org.br/encontro/2019/submissao/files_I/i12-996e1e67a264e36bf067c6d0470cd495.pdf;i12;Área 12 - Economia Social e Demografia Econômica
IMPACTO DO PROGRAMA MAIS MÉDICO NAS TAXAS DE MORTALIDADE (2010-2015);https://www.anpec.org.br/encontro/2019/submissao/files_I/i12-77aa81bbeaf91194a1429e9147649144.docx;i12;Área 12 - Economia Social e Demografia Econômica
IMPACTO DO PSF NA MORTALIDADE INFANTIL NOS MUNICÍPIOS BRASILEIROS;https://www.anpec.org.br/encontro/2019/submissao/files_I/i12-b2a76a46e8f6bf8551c24e9d8a552dc0.pdf;i12;Área 12 - Economia Social e Demografia Econômica
NATURAL RESOURCES AND EARLY-LIFE HEALTH CONDITIONS: EVIDENCE FROM COLOMBIA;https://www.anpec.org.br/encontro/2019/submissao/files_I/i12-c777ec5eedefff478b65cffc86c94fe4.pdf;i12;Área 12 - Economia Social e Demografia Econômica
O EFEITO DA CRIAÇÃO DO BPC SOBRE A POUPANÇA FAMILIAR;https://www.anpec.org.br/encontro/2019/submissao/files_I/i12-954b7137d6ce01619365fc5003afd65d.pdf;i12;Área 12 - Economia Social e Demografia Econômica
