texto;links;code_area;area
O EFEITO DA PARCELA DE CONTRIBUIÇÃO DA MÃE NO ORÇAMENTO FAMILIAR SOBRE OS RESULTADOS NUTRICIONAIS DOS FILHOS: EVIDÊNCIAS A PARTIR DAS PESQUISAS DE ORÇAMENTOS FAMILIARES NO BRASIL;https://www.anpec.org.br/encontro/2019/submissao/files_I/i12-a637f8f37c49e98988ab14eda0e8c5d1.pdf;i12;Área 12 - Economia Social e Demografia Econômica
O IMPACTO DA EXPANSÃO DO PROGRAMA BOLSA FAMÍLIA NA EDUCAÇÃO DE JOVENS E ADULTOS;https://www.anpec.org.br/encontro/2019/submissao/files_I/i12-a6097f17d2c9c2cd6651061840e9d67f.docx;i12;Área 12 - Economia Social e Demografia Econômica
OS GASTOS FEDERAIS COM ASSISTÊNCIA SOCIAL DIMINUEM OS GASTOS LOCAIS? ESTIMANDO O EFEITO CROWDING OUT DOS GASTOS SOCIAIS NO BRASIL;https://www.anpec.org.br/encontro/2019/submissao/files_I/i12-cb77ad52c517bbbd37996494e90555c5.pdf;i12;Área 12 - Economia Social e Demografia Econômica
PADRÕES RECENTES DE INSERÇÃO E MOBILIDADE NO TRABALHO DOMÉSTICO NO BRASIL METROPOLITANO: DESCONTINUIDADES E PERSISTÊNCIAS;https://www.anpec.org.br/encontro/2019/submissao/files_I/i12-c942a47539ebd5c5fede7ec4a65b3b89.pdf;i12;Área 12 - Economia Social e Demografia Econômica
POLÍTICAS DE FINANCIAMENTO ESTUDANTIL: ANÁLISE DE IMPACTO DO FIES NO TEMPO DE CONCLUSÃO DO ENSINO SUPERIOR;https://www.anpec.org.br/encontro/2019/submissao/files_I/i12-7dec63b40c70373c970265d63e3a6936.pdf;i12;Área 12 - Economia Social e Demografia Econômica
PROGRAMA “AQUI TEM FARMÁCIA POPULAR” E HIPERTENSÃO ARTERIAL: UMA ESTRATÉGIA DE IDENTIFICAÇÃO ATRAVÉS DE UM MODELO DE DIFERENÇAS EM DIFERENÇAS.;https://www.anpec.org.br/encontro/2019/submissao/files_I/i12-195020a7ea7cda8b59a2db0718b82e0e.pdf;i12;Área 12 - Economia Social e Demografia Econômica
RACIAL DEMOCRACY AND BLACK VITIMIZATION IN BRAZIL;https://www.anpec.org.br/encontro/2019/submissao/files_I/i12-818f7679b7ec24eaf8faff5d482fe446.pdf;i12;Área 12 - Economia Social e Demografia Econômica
REPROVAÇÃO E EFEITOS SOBRE RESULTADOS EDUCACIONAIS;https://www.anpec.org.br/encontro/2019/submissao/files_I/i12-6e7cf742d51387586c43072e963949ae.pdf;i12;Área 12 - Economia Social e Demografia Econômica
SPATIAL SPILLOVER OF A CRIME CRACKDOWN POLICY IN BRAZIL: THE CASE OF THE PACIFYING POLICE UNITS (UPPS);https://www.anpec.org.br/encontro/2019/submissao/files_I/i12-11277c1df6ace22a16b17d49e1d072ec.pdf;i12;Área 12 - Economia Social e Demografia Econômica
TEMPO NA ESCOLA E MOTIVAÇÕES EDUCACIONAIS: IMPACTOS DO BOLSA FAMÍLIA;https://www.anpec.org.br/encontro/2019/submissao/files_I/i12-7f48d5231024dc5d170c95a2407a2fdf.pdf;i12;Área 12 - Economia Social e Demografia Econômica
WHAT ARE THE MAIN DRIVERS OF BRAZILIAN INCOME DISTRIBUTION CHANGES IN THE NEW MILLENNIUM?;https://www.anpec.org.br/encontro/2019/submissao/files_I/i12-61bf347c0c1b3e2f87a72d9e00014f06.pdf;i12;Área 12 - Economia Social e Demografia Econômica
A ÉTICA PROTESTANTE E O ESPÍRITO DO CAPITALISMO: PREFERÊNCIAS QUANTO AO MERCADO DE TRABALHO, EMPREENDEDORISMO E A ESTRUTURA FAMILIAR NO BRASIL;https://www.anpec.org.br/encontro/2019/submissao/files_I/i13-24c4b37405b9f1ed5cfb3041f67212a8.pdf;i13;Área 13 - Economia do Trabalho
DINÂMICA DA POLARIZAÇÃO DA OFERTA DE TRABALHO FAMILIAR NO BRASIL URBANO;https://www.anpec.org.br/encontro/2019/submissao/files_I/i13-94ea60139b4a2453dba4e4494e6a83fe.pdf;i13;Área 13 - Economia do Trabalho
DOES RISK AVERSION INCREASE THE WILLINGNESS TO BECOME A TEACHER IN BRAZIL? AN INVESTIGATION OF RISK PREFERENCE AND OCCUPATION CHOICE AMONG STUDENTS OF TEACHER TRAINING PROGRAMS;https://www.anpec.org.br/encontro/2019/submissao/files_I/i13-bb35ced0b8fb3169105e6ba3527527a8.pdf;i13;Área 13 - Economia do Trabalho
DURAÇÃO DO DESEMPREGO E CRISE ECONÔMICA: UMA ANÁLISE SOB RISCOS COMPETITIVOS PARA O BRASIL NO PERÍODO 2012-2018;https://www.anpec.org.br/encontro/2019/submissao/files_I/i13-84ce2bbac12611cf95343d10b6c190e4.pdf;i13;Área 13 - Economia do Trabalho
ESTIMATIVA PARA A CURVA DE SALÁRIO NO BRASIL: EVIDÊNCIAS A PARTIR DE INTERAÇÕES ESPACIAIS EM TEMPOS DE RECESSÃO;https://www.anpec.org.br/encontro/2019/submissao/files_I/i13-9e2c197ae9af7470030455ac8957b164.pdf;i13;Área 13 - Economia do Trabalho
EVOLUÇÃO DOS PRÊMIOS SALARIAIS RELATIVOS A HABILIDADES OCUPACIONAIS: UMA ANÁLISE DO PERÍODO DE 2006 A 2016;https://www.anpec.org.br/encontro/2019/submissao/files_I/i13-ffe6ef9bbd3fdf68dd8592370da6df32.docx;i13;Área 13 - Economia do Trabalho
EXPLICANDO A EVOLUÇÃO DOS SALÁRIOS RELATIVOS POR GRUPOS DE QUALIFICAÇÃO NO BRASIL;https://www.anpec.org.br/encontro/2019/submissao/files_I/i13-82d18b18170788c82cdd4a39030f67ad.pdf;i13;Área 13 - Economia do Trabalho
INFORMAL JOBS, SAMPLE SELECTION AND URBAN WAGE PREMIUM IN BRAZIL: EVIDENCE FROM 2012 TO 2018;https://www.anpec.org.br/encontro/2019/submissao/files_I/i13-fa276c4420fa16bcad55323dfa0559c5.pdf;i13;Área 13 - Economia do Trabalho
MOBILIDADE INTERGERACIONAL DE RENDA NO BRASIL: UMA ANÁLISE DA EVOLUÇÃO NOS ÚLTIMOS 20 ANOS;https://www.anpec.org.br/encontro/2019/submissao/files_I/i13-4992633d989fd7cd5f7f6f5ad673b451.pdf;i13;Área 13 - Economia do Trabalho
O EFEITO DE FILHOS COM DEFICIÊNCIA INTELECTUAL NA OFERTA DE TRABALHO DAS MÃES NO BRASIL;https://www.anpec.org.br/encontro/2019/submissao/files_I/i13-f4c72e56b11e106dec0ebe38a964187b.pdf;i13;Área 13 - Economia do Trabalho
O ESPAÇO SETORIAL-OCUPACIONAL REVELA A ESTRATIFICAÇÃO SOCIOECONÔMICA NO BRASIL;https://www.anpec.org.br/encontro/2019/submissao/files_I/i13-f4935ecbc20c983a017f0cd958943acd.docx;i13;Área 13 - Economia do Trabalho
O IMPACTO DA “LEI DO DESCANSO” NAS HORAS MENSAIS TRABALHADAS, NOS SALÁRIOS E NOS ACIDENTES NÃO-FATAIS DO TRABALHO DOS CAMINHONEIROS BRASILEIROS;https://www.anpec.org.br/encontro/2019/submissao/files_I/i13-71e5bc7a3348c1533d553985d2b08c8f.pdf;i13;Área 13 - Economia do Trabalho
PEER EFFECT? AN EMPIRICAL ESSAY ON THE INFLUENCE OF FRIENDS ON THE ENTREPRENEURIAL INTENTION OF STUDENTS OF A BRAZILIAN FEDERAL INSTITUTE OF TECHNOLOGY;https://www.anpec.org.br/encontro/2019/submissao/files_I/i13-3c1fff5b67289ccedde4ba06bec799df.docx;i13;Área 13 - Economia do Trabalho
STRUCTURAL VS. QUASI-EXPERIMENTAL POLICY EVALUATION: THE PAROLL TAX EXEMPTION IN BRAZIL;https://www.anpec.org.br/encontro/2019/submissao/files_I/i13-df8c68c9897479ad48964d33b0e12d3f.pdf;i13;Área 13 - Economia do Trabalho
SURVIVAL ANALYSIS OF YOUNG PEOPLE IN THEIR FIRST EMPLOYMENT IN BRAZIL;https://www.anpec.org.br/encontro/2019/submissao/files_I/i13-1653ca749055b61cf900ac694c712b6f.pdf;i13;Área 13 - Economia do Trabalho
THE CONSEQUENCES OF PARENTS’ UNEMPLOYMENT ON INVESTMENTS IN CHILDREN’S EDUCATION IN BRAZIL;https://www.anpec.org.br/encontro/2019/submissao/files_I/i13-bde117f036c50cc106163141d2c9ec2d.docx;i13;Área 13 - Economia do Trabalho
UNEQUAL HEAD START: HETEROGENEOUS SHORT-TERM IMPACTS OF GRADUATING ON EMPLOYMENT AND INCOME - A FIXED-EFFECTS REGRESSION ANALYSIS;https://www.anpec.org.br/encontro/2019/submissao/files_I/i13-4de26e94b0851f14fd9b5564fd95368e.pdf;i13;Área 13 - Economia do Trabalho
WHAT DRIVES THE EFFECT OF LABOR INSPECTIONS ON FORMAL LABOR? THE ROLES OF INFORMATION AND PUNISHMENT;https://www.anpec.org.br/encontro/2019/submissao/files_I/i13-c9a0a29a1a966fe6ff6f3ec515df83bb.pdf;i13;Área 13 - Economia do Trabalho
